{
  "id": 64072843,
  "first_name": "Jane",
  "middle_name": "Marie",
  "last_name": "Smith",
  "dob": "1985-04-15",
  "sex": "Female",
  "gender_identity": "woman",
  "pronouns": "she_her_hers",
  "race": "White",
  "ethnicity": "Not Hispanic or Latino",
  "preferred_language": "English",
  "preferred_contact": "email",
  "primary_physician": 131072,
  "caregiver_practice": 65540,
  "address": {
    "address_line1": "123 Main Street",
    "address_line2": "Apt 4B",
    "city": "San Francisco",
    "state": "CA",
    "zip": "94105"
  },
  "phones": [
    {
      "phone": "415-555-0100",
      "phone_type": "Cell"
    }
  ],
  "emails": [
    {
      "email": "jane.smith@example.com"
    }
  ],
  "patient_status": {
    "status": "Active"
  },
  "vip": false,
  "verified": true,
  "tags": ["new-patient"],
  "metadata": {},
  "created_date": "2026-01-10T09:00:00Z",
  "deleted_date": null,
  "merged_into_chart": null
}
